{
  "version": 1,
  "seed": 10,
  "pharmacology": {
    "dose_step": "breakthrough",
    "dose_rel": 4.0,
    "hold_fraction": 1.0,
    "sensitivity": 1.0,
    "clearance": 1.0,
    "params": {
      "ka": 4.0,
      "k10": 0.12,
      "k12": 0.2,
      "k21": 0.03,
      "ke0": [
        2.5,
        1.2,
        0.6
      ],
      "h": 2.0
    }
  },
  "predicted": {
    "peak_visual": 8.57,
    "deepest_layer": "breakthrough",
    "minutes_above_8": 2.19
  },
  "palette": {
    "name": "verdant",
    "colours": [
      "#03140a",
      "#1f8a4c",
      "#8fe36b",
      "#f4e285",
      "#2bb5a0"
    ]
  },
  "room": {
    "source": "panorama",
    "image": "assets/room.jpg",
    "depth": "assets/room_depth.png"
  },
  "layers": {
    "form_constants": {
      "mode": "hexagons",
      "wavelength": 1.0,
      "spiral_bias": 0.2
    },
    "chrysanthemum": {
      "groups": [
        [
          2,
          4,
          5
        ]
      ],
      "kleinian": {
        "trace_a": [
          2.0,
          0.0
        ],
        "trace_b": [
          2.0,
          0.0
        ]
      }
    },
    "waiting_room": {
      "kind": "mandelbox"
    }
  },
  "breakthrough": {
    "reached": true,
    "world": {
      "category": "workshop",
      "prompt": "a humming workshop of luminous moving gears and glowing instruments, intricate, no text",
      "image": "assets/world_0.png",
      "procedural": false
    },
    "entities": [
      {
        "type": "creature_reptilian",
        "label": "being",
        "attributes": {
          "conscious": true,
          "intelligent": true,
          "benevolent": false,
          "sacred": false
        },
        "disposition": "stern",
        "communication": "none",
        "behaviours": [
          "approach",
          "work_on"
        ],
        "sprites": [
          "assets/entity_0_a.png",
          "assets/entity_0_b.png",
          "assets/entity_0_c.png"
        ],
        "procedural": false
      },
      {
        "type": "creature_tentacled",
        "label": "spirit",
        "attributes": {
          "conscious": true,
          "intelligent": true,
          "benevolent": true,
          "sacred": false
        },
        "disposition": "indifferent",
        "communication": "none",
        "behaviours": [
          "work_on",
          "depart"
        ],
        "sprites": [
          "assets/entity_1_a.png",
          "assets/entity_1_b.png",
          "assets/entity_1_c.png"
        ],
        "procedural": false
      }
    ],
    "message": {
      "present": false,
      "sealed_text": null,
      "glyph_seed": 7
    }
  },
  "challenge": {
    "occurs": true,
    "onset_offset_s": 0.0,
    "flavour": "pursuit"
  },
  "report": {
    "length_words": 500,
    "profundity": false
  },
  "contingency": {
    "breakthrough_assets": true
  },
  "provenance": {
    "planner": "llm",
    "images": "sdxl_lightning"
  }
}
