{
  "version": 1,
  "seed": 12,
  "pharmacology": {
    "dose_step": "breakthrough",
    "dose_rel": 4.0,
    "hold_fraction": 1.0,
    "sensitivity": 0.95,
    "clearance": 1.05,
    "params": {
      "ka": 4.0,
      "k10": 0.12,
      "k12": 0.2,
      "k21": 0.03,
      "ke0": [
        2.5,
        1.2,
        0.6
      ],
      "h": 2.0
    }
  },
  "predicted": {
    "peak_visual": 8.42,
    "deepest_layer": "breakthrough",
    "minutes_above_8": 1.81
  },
  "palette": {
    "name": "ember",
    "colours": [
      "#1a0600",
      "#ff6a00",
      "#ffb000",
      "#ffd27a",
      "#9c1f3a"
    ]
  },
  "room": {
    "source": "default",
    "image": null,
    "depth": null
  },
  "layers": {
    "form_constants": {
      "mode": "mixed",
      "wavelength": 1.0,
      "spiral_bias": 0.3
    },
    "chrysanthemum": {
      "groups": [
        [
          2,
          3,
          7
        ],
        [
          2,
          3,
          9
        ]
      ],
      "kleinian": {
        "trace_a": [
          2.0,
          0.0
        ],
        "trace_b": [
          2.0,
          0.0
        ]
      }
    },
    "waiting_room": {
      "kind": "fractal"
    }
  },
  "breakthrough": {
    "reached": true,
    "world": {
      "category": "carnival",
      "prompt": "a radiant carnival of spinning patterned light and tents made of geometry, playful, no text",
      "image": "assets/world_0.png",
      "procedural": false
    },
    "entities": [
      {
        "type": "living_geometry",
        "label": "being",
        "attributes": {
          "conscious": true,
          "intelligent": true,
          "benevolent": true,
          "sacred": false
        },
        "disposition": "playful",
        "communication": "two_way",
        "behaviours": [
          "approach",
          "greet",
          "show",
          "present_object",
          "work_on",
          "transform",
          "depart"
        ],
        "sprites": [
          "assets/entity_0_a.png",
          "assets/entity_0_b.png",
          "assets/entity_0_c.png"
        ],
        "procedural": false,
        "beats": [
          {
            "behaviour": "approach",
            "at_s": 0,
            "note": "drifts closer, unfolding"
          },
          {
            "behaviour": "greet",
            "at_s": 6,
            "note": "turns all its faces toward the viewer"
          },
          {
            "behaviour": "show",
            "at_s": 15,
            "note": "opens into a lattice of moving colour"
          },
          {
            "behaviour": "present_object",
            "at_s": 28,
            "note": "offers a small spinning polyhedron"
          },
          {
            "behaviour": "work_on",
            "at_s": 40,
            "note": "rearranges the patterns around the viewer"
          },
          {
            "behaviour": "transform",
            "at_s": 55,
            "note": "becomes a spiral of light"
          },
          {
            "behaviour": "depart",
            "at_s": 75,
            "note": "folds away into the carnival"
          }
        ]
      }
    ],
    "message": {
      "present": true,
      "sealed_text": "Play is a way of paying attention.",
      "glyph_seed": 31
    }
  },
  "challenge": {
    "occurs": false,
    "onset_offset_s": null,
    "flavour": null
  },
  "report": {
    "length_words": 380,
    "profundity": false
  },
  "contingency": {
    "breakthrough_assets": true
  },
  "provenance": {
    "planner": "llm",
    "images": "sdxl_lightning"
  }
}
