{
  "version": 1,
  "seed": 9,
  "pharmacology": {
    "dose_step": "strong",
    "dose_rel": 2.0,
    "hold_fraction": 1.0,
    "sensitivity": 1.45,
    "clearance": 0.9,
    "params": {
      "ka": 4.0,
      "k10": 0.12,
      "k12": 0.2,
      "k21": 0.03,
      "ke0": [
        2.5,
        1.2,
        0.6
      ],
      "h": 2.0
    }
  },
  "predicted": {
    "peak_visual": 7.63,
    "deepest_layer": "waiting_room",
    "minutes_above_8": 0.0
  },
  "palette": {
    "name": "neon",
    "colours": [
      "#0a0021",
      "#ff2fd1",
      "#2ff3ff",
      "#b6ff3b",
      "#7a3cff"
    ]
  },
  "room": {
    "source": "photo",
    "image": "assets/room.jpg",
    "depth": "assets/room_depth.png"
  },
  "layers": {
    "form_constants": {
      "mode": "stripes",
      "wavelength": 0.9,
      "spiral_bias": 0.5
    },
    "chrysanthemum": {
      "groups": [
        [
          2,
          3,
          9
        ]
      ],
      "kleinian": {
        "trace_a": [
          2.0,
          0.0
        ],
        "trace_b": [
          2.0,
          0.0
        ]
      }
    },
    "waiting_room": {
      "kind": "fractal"
    }
  },
  "breakthrough": {
    "reached": false,
    "world": {
      "category": "cosmic_space",
      "prompt": "an ocean of self-luminous nebulae and turning geometric stars, hyper-saturated, no text",
      "image": "assets/world_0.png",
      "procedural": false
    },
    "entities": [
      {
        "type": "alien",
        "label": "alien",
        "attributes": {
          "conscious": true,
          "intelligent": true,
          "benevolent": true,
          "sacred": false
        },
        "disposition": "benevolent",
        "communication": "two_way",
        "behaviours": [
          "approach",
          "greet",
          "show",
          "depart"
        ],
        "sprites": [
          "assets/entity_0_a.png",
          "assets/entity_0_b.png",
          "assets/entity_0_c.png"
        ],
        "procedural": false
      },
      {
        "type": "mythological",
        "label": "being",
        "attributes": {
          "conscious": true,
          "intelligent": true,
          "benevolent": true,
          "sacred": false
        },
        "disposition": "playful",
        "communication": "entity_to_user",
        "behaviours": [
          "present_object",
          "transform"
        ],
        "sprites": [
          "assets/entity_1_a.png",
          "assets/entity_1_b.png",
          "assets/entity_1_c.png"
        ],
        "procedural": false
      }
    ],
    "message": {
      "present": true,
      "sealed_text": "Curiosity is a door that opens from both sides.",
      "glyph_seed": 99
    }
  },
  "challenge": {
    "occurs": false,
    "onset_offset_s": null,
    "flavour": null
  },
  "report": {
    "length_words": 450,
    "profundity": false
  },
  "contingency": {
    "breakthrough_assets": true
  },
  "provenance": {
    "planner": "llm",
    "images": "sdxl_lightning"
  }
}
