{
  "version": 1,
  "seed": 11,
  "pharmacology": {
    "dose_step": "breakthrough",
    "dose_rel": 3.6,
    "hold_fraction": 0.9,
    "sensitivity": 1.1,
    "clearance": 1.0,
    "params": {
      "ka": 4.0,
      "k10": 0.12,
      "k12": 0.2,
      "k21": 0.03,
      "ke0": [
        2.5,
        1.2,
        0.6
      ],
      "h": 2.0
    }
  },
  "predicted": {
    "peak_visual": 8.54,
    "deepest_layer": "breakthrough",
    "minutes_above_8": 2.13
  },
  "palette": {
    "name": "jewel",
    "colours": [
      "#1b0b4a",
      "#3f1fd1",
      "#00b3a4",
      "#f2c14e",
      "#e0407a"
    ]
  },
  "room": {
    "source": "photo",
    "image": "assets/room.jpg",
    "depth": "assets/room_depth.png"
  },
  "layers": {
    "form_constants": {
      "mode": "stripes",
      "wavelength": 0.9,
      "spiral_bias": 0.3
    },
    "chrysanthemum": {
      "groups": [
        [
          2,
          3,
          7
        ]
      ],
      "kleinian": {
        "trace_a": [
          2.0,
          0.0
        ],
        "trace_b": [
          2.0,
          0.0
        ]
      }
    },
    "waiting_room": {
      "kind": "fractal"
    }
  },
  "breakthrough": {
    "reached": true,
    "world": {
      "category": "organic_jungle",
      "prompt": "a glowing jungle of jewelled leaves and breathing light, hyper-saturated, alive, no text",
      "image": "assets/world_0.png",
      "procedural": false
    },
    "entities": [
      {
        "type": "creature_insectoid",
        "label": "helper",
        "attributes": {
          "conscious": true,
          "intelligent": true,
          "benevolent": true,
          "sacred": false
        },
        "disposition": "benevolent",
        "communication": "entity_to_user",
        "behaviours": [
          "approach",
          "present_object",
          "depart"
        ],
        "sprites": [
          "assets/entity_0_a.png",
          "assets/entity_0_b.png",
          "assets/entity_0_c.png"
        ],
        "procedural": false
      },
      {
        "type": "creature_feline",
        "label": "guide",
        "attributes": {
          "conscious": true,
          "intelligent": true,
          "benevolent": true,
          "sacred": false
        },
        "disposition": "playful",
        "communication": "two_way",
        "behaviours": [
          "greet",
          "show",
          "depart"
        ],
        "sprites": [
          "assets/entity_1_a.png",
          "assets/entity_1_b.png",
          "assets/entity_1_c.png"
        ],
        "procedural": false
      }
    ],
    "message": {
      "present": true,
      "sealed_text": "Wonder does not need a reason to stay.",
      "glyph_seed": 5
    }
  },
  "challenge": {
    "occurs": false,
    "onset_offset_s": null,
    "flavour": null
  },
  "report": {
    "length_words": 280,
    "profundity": false
  },
  "contingency": {
    "breakthrough_assets": true
  },
  "provenance": {
    "planner": "llm",
    "images": "sdxl_lightning"
  }
}
